user_id,completed_course,performance,next_course,actual_time,exam_score
6,Bitcoin or How I Learned to Stop Worrying and Love Crypto,Understands well,Introduction to Cryptocurrencies and Blockchain,7.0,90.0
2,Bitcoin or How I Learned to Stop Worrying and Love Crypto,Needs improvement,"Bitcoins - Past, Present, Future",15.0,50.0
7,Stock Market Investing for Beginners,Needs improvement,Stocks For Beginners - A Guide To Investing,3.0,87.0
1,Accounting in 60 Minutes - A Brief Introduction,Needs improvement,Accounting Cycle: Learn the concepts in 60 minutes,45.0,78.0
3,Fundamentals of Forex Trading,Understands well,Forex Trading Plan,1.0,96.0
